{
  "title": "対話するだけで提案書が完成するAIシステムの紹介",
  "description": "提案書作成の3大課題を提示し、レシピ層を核とした3層アーキテクチャ（思考→レシピ→実行）で解決。レシピによるテンプレート横断・パターン蓄積を紹介し、導入効果と今後の展開で締める。",
  "slides": [
    {
      "index": 0,
      "type": "title",
      "title": "対話するだけで提案書が完成するAIシステムの紹介",
      "note": "表紙 2026年2月"
    },
    {
      "index": 1,
      "type": "agenda",
      "title": "アジェンダ",
      "note": "4章構成"
    },
    {
      "index": 2,
      "type": "chapter",
      "title": "1. 提案書作成の課題",
      "note": "現状の痛み"
    },
    {
      "index": 3,
      "type": "content",
      "title": "時間・品質・再利用の3つの壁",
      "note": "3軸で課題を並列整理"
    },
    {
      "index": 4,
      "type": "chapter",
      "title": "2. システムの仕組み",
      "note": "3層アーキテクチャ"
    },
    {
      "index": 5,
      "type": "content",
      "title": "設計意図と実行を分離する3層構造",
      "note": "思考層→レシピ→実行層のフロー図"
    },
    {
      "index": 6,
      "type": "content",
      "title": "レシピが実現するテンプレート横断",
      "note": "同じレシピからSX・JR等に変換 before_after型"
    },
    {
      "index": 7,
      "type": "content",
      "title": "対話だけで完結する操作フロー",
      "note": "要望→レシピ→PPTX→品質確認の4ステップ"
    },
    {
      "index": 8,
      "type": "chapter",
      "title": "3. 使うほど賢くなる仕組み",
      "note": "パターン蓄積"
    },
    {
      "index": 9,
      "type": "content",
      "title": "パターンカタログが品質の底上げを実現",
      "note": "SWOT,フロー等のパターン蓄積サイクル"
    },
    {
      "index": 10,
      "type": "chapter",
      "title": "4. 導入効果と今後の展開",
      "note": ""
    },
    {
      "index": 11,
      "type": "content",
      "title": "定量効果と将来ロードマップ",
      "note": "時間93%削減・品質統一・再利用80%のKPI + 3段階ロードマップ"
    },
    {
      "index": 12,
      "type": "end",
      "title": "ご確認ありがとうございました",
      "note": ""
    }
  ],
  "template": "jr_east"
}